[
  {
    "repo": "meiji163/gh-notify",
    "name": "notify",
    "category": "Notifications",
    "summary": "Display GitHub notifications in the terminal.",
    "install": "gh extension install meiji163/gh-notify",
    "best_for": "Developers who want notification awareness without the browser.",
    "avoid_if": "You already manage notifications through email or mobile.",
    "stars": 344,
    "license": "Unlicense",
    "last_pushed_at": "2026-06-05T14:21:26Z",
    "archived": false,
    "official": false,
    "verified_at": "2026-06-08",
    "status": "active"
  },
  {
    "repo": "emmanuel-ferdman/gh-gonest",
    "name": "gonest",
    "category": "Notifications",
    "summary": "Remove phantom notifications from inaccessible repositories.",
    "install": "gh extension install emmanuel-ferdman/gh-gonest",
    "best_for": "Users stuck with notifications from deleted or inaccessible repositories.",
    "avoid_if": "Your notification inbox is already clean.",
    "stars": 118,
    "license": "MIT",
    "last_pushed_at": "2025-12-20T13:01:38Z",
    "archived": false,
    "official": false,
    "verified_at": "2026-06-08",
    "status": "active"
  },
  {
    "repo": "k1LoW/gh-triage",
    "name": "triage",
    "category": "Notifications",
    "summary": "Manage issues and pull requests through unread notifications.",
    "install": "gh extension install k1LoW/gh-triage",
    "best_for": "Maintainers who triage from their notification inbox.",
    "avoid_if": "You do not use GitHub notifications as a work queue.",
    "stars": 35,
    "license": "MIT",
    "last_pushed_at": "2025-12-17T00:24:02Z",
    "archived": false,
    "official": false,
    "verified_at": "2026-06-08",
    "status": "active"
  },
  {
    "repo": "nobe4/gh-not",
    "name": "not",
    "category": "Notifications",
    "summary": "Manage GitHub notifications with rules.",
    "install": "gh extension install nobe4/gh-not",
    "best_for": "Users who need filtering and rule-based notification handling.",
    "avoid_if": "You only need to view notifications occasionally.",
    "stars": 31,
    "license": "MIT",
    "last_pushed_at": "2026-06-08T00:28:31Z",
    "archived": false,
    "official": false,
    "verified_at": "2026-06-08",
    "status": "active"
  }
]
