[
  {
    "repo": "github/gh-gei",
    "name": "gei",
    "category": "Security/Admin",
    "summary": "Support GitHub Enterprise Importer migration workflows.",
    "install": "gh extension install github/gh-gei",
    "best_for": "Enterprise teams migrating repositories to GitHub Enterprise Cloud.",
    "avoid_if": "You are not running GitHub migration projects.",
    "stars": 455,
    "license": "MIT",
    "last_pushed_at": "2026-06-03T21:11:14Z",
    "archived": false,
    "official": true,
    "verified_at": "2026-06-08",
    "status": "active"
  },
  {
    "repo": "Link-/gh-token",
    "name": "token",
    "category": "Security/Admin",
    "summary": "Create installation access tokens for GitHub Apps.",
    "install": "gh extension install Link-/gh-token",
    "best_for": "Developers working with GitHub App authentication.",
    "avoid_if": "You only use personal access tokens or browser flows.",
    "stars": 394,
    "license": "NOASSERTION",
    "last_pushed_at": "2026-03-25T12:34:40Z",
    "archived": false,
    "official": false,
    "verified_at": "2026-06-08",
    "status": "active"
  },
  {
    "repo": "mona-actions/gh-repo-stats",
    "name": "repo-stats",
    "category": "Security/Admin",
    "summary": "Collect repository metadata used in GitHub migration work.",
    "install": "gh extension install mona-actions/gh-repo-stats",
    "best_for": "Migration specialists gathering repository inventory data.",
    "avoid_if": "You do not work on repository migration or audit projects.",
    "stars": 389,
    "license": "MIT",
    "last_pushed_at": "2026-03-13T20:17:48Z",
    "archived": false,
    "official": false,
    "verified_at": "2026-06-08",
    "status": "active"
  },
  {
    "repo": "babarot/gh-infra",
    "name": "infra",
    "category": "Security/Admin",
    "summary": "Manage GitHub infrastructure declaratively with YAML.",
    "install": "gh extension install babarot/gh-infra",
    "best_for": "Teams that want repository and organization settings as code.",
    "avoid_if": "You only manage one or two repositories manually.",
    "stars": 120,
    "license": "MIT",
    "last_pushed_at": "2026-05-20T05:58:25Z",
    "archived": false,
    "official": false,
    "verified_at": "2026-06-08",
    "status": "active"
  },
  {
    "repo": "github/gh-classroom",
    "name": "classroom",
    "category": "Security/Admin",
    "summary": "Manage GitHub Classroom workflows from the terminal.",
    "install": "gh extension install github/gh-classroom",
    "best_for": "Educators using GitHub Classroom at scale.",
    "avoid_if": "You do not use GitHub Classroom.",
    "stars": 117,
    "license": "MIT",
    "last_pushed_at": "2026-05-19T19:50:20Z",
    "archived": false,
    "official": true,
    "verified_at": "2026-06-08",
    "status": "active"
  },
  {
    "repo": "twelvelabs/gh-repo-config",
    "name": "repo-config",
    "category": "Security/Admin",
    "summary": "Manage repository settings from GitHub CLI.",
    "install": "gh extension install twelvelabs/gh-repo-config",
    "best_for": "Teams standardizing repository configuration.",
    "avoid_if": "You only manage settings through the GitHub web UI.",
    "stars": 42,
    "license": "MIT",
    "last_pushed_at": "2026-04-20T07:14:34Z",
    "archived": false,
    "official": false,
    "verified_at": "2026-06-08",
    "status": "active"
  },
  {
    "repo": "cli/gh-webhook",
    "name": "webhook",
    "category": "Security/Admin",
    "summary": "Work with GitHub webhooks from GitHub CLI.",
    "install": "gh extension install cli/gh-webhook",
    "best_for": "Developers testing webhook-driven integrations.",
    "avoid_if": "You do not build GitHub integrations.",
    "stars": 40,
    "license": "MIT",
    "last_pushed_at": "2025-10-21T16:21:44Z",
    "archived": false,
    "official": true,
    "verified_at": "2026-06-08",
    "status": "active"
  },
  {
    "repo": "advanced-security/gh-code-scanning",
    "name": "code-scanning",
    "category": "Security/Admin",
    "summary": "Inspect GitHub code scanning data from the terminal.",
    "install": "gh extension install advanced-security/gh-code-scanning",
    "best_for": "Security teams that need quick access to code scanning findings.",
    "avoid_if": "You do not use GitHub code scanning.",
    "stars": 29,
    "license": "NOASSERTION",
    "last_pushed_at": "2025-12-15T11:53:05Z",
    "archived": false,
    "official": true,
    "verified_at": "2026-06-08",
    "status": "active"
  },
  {
    "repo": "advanced-security/gh-sbom",
    "name": "sbom",
    "category": "Security/Admin",
    "summary": "Generate software bills of materials with GitHub CLI.",
    "install": "gh extension install advanced-security/gh-sbom",
    "best_for": "Teams that need SBOM output during release or compliance work.",
    "avoid_if": "Your SBOM workflow is already handled by another build step.",
    "stars": 206,
    "license": "MIT",
    "last_pushed_at": "2025-05-30T19:40:06Z",
    "archived": false,
    "official": true,
    "verified_at": "2026-06-08",
    "status": "watch"
  },
  {
    "repo": "GitHubSecurityLab/gh-mrva",
    "name": "mrva",
    "category": "Security/Admin",
    "summary": "Run CodeQL queries at scale with multi-repository variant analysis.",
    "install": "gh extension install GitHubSecurityLab/gh-mrva",
    "best_for": "Security researchers analyzing many repositories.",
    "avoid_if": "You only scan one local repository.",
    "stars": 66,
    "license": "MIT",
    "last_pushed_at": "2025-04-16T23:34:08Z",
    "archived": false,
    "official": true,
    "verified_at": "2026-06-08",
    "status": "watch"
  },
  {
    "repo": "GitHubSecurityLab/gh-qldb",
    "name": "qldb",
    "category": "Security/Admin",
    "summary": "Manage CodeQL databases from GitHub CLI.",
    "install": "gh extension install GitHubSecurityLab/gh-qldb",
    "best_for": "Security engineers working directly with CodeQL databases.",
    "avoid_if": "You do not use CodeQL database workflows.",
    "stars": 49,
    "license": "NOASSERTION",
    "last_pushed_at": "2025-04-16T21:32:20Z",
    "archived": false,
    "official": true,
    "verified_at": "2026-06-08",
    "status": "watch"
  },
  {
    "repo": "github/gh-codeql",
    "name": "codeql",
    "category": "Security/Admin",
    "summary": "Work with CodeQL through GitHub CLI.",
    "install": "gh extension install github/gh-codeql",
    "best_for": "Security engineers running CodeQL workflows.",
    "avoid_if": "You do not use CodeQL.",
    "stars": 39,
    "license": "MIT",
    "last_pushed_at": "2025-02-14T05:45:55Z",
    "archived": false,
    "official": true,
    "verified_at": "2026-06-08",
    "status": "watch"
  },
  {
    "repo": "andyfeller/gh-ssh-allowed-signers",
    "name": "ssh-allowed-signers",
    "category": "Security/Admin",
    "summary": "Generate SSH allowed signers files for SSH commit signing.",
    "install": "gh extension install andyfeller/gh-ssh-allowed-signers",
    "best_for": "Organizations standardizing SSH signature verification.",
    "avoid_if": "You do not use SSH signing.",
    "stars": 30,
    "license": "NOASSERTION",
    "last_pushed_at": "2025-01-21T15:07:15Z",
    "archived": false,
    "official": false,
    "verified_at": "2026-06-08",
    "status": "watch"
  },
  {
    "repo": "mislav/gh-repo-collab",
    "name": "repo-collab",
    "category": "Security/Admin",
    "summary": "Manage repository collaborators from GitHub CLI.",
    "install": "gh extension install mislav/gh-repo-collab",
    "best_for": "Repository maintainers who manage collaborator access.",
    "avoid_if": "You need organization-wide permission management.",
    "stars": 57,
    "license": "NOASSERTION",
    "last_pushed_at": "2023-07-10T15:44:57Z",
    "archived": false,
    "official": false,
    "verified_at": "2026-06-08",
    "status": "stale"
  }
]
