[
  {
    "repo": "github/gh-actions-importer",
    "name": "actions-importer",
    "category": "Actions/CI",
    "summary": "Plan and automate migrations into GitHub Actions.",
    "install": "gh extension install github/gh-actions-importer",
    "best_for": "Enterprise teams migrating from other CI systems.",
    "avoid_if": "Your project is already on GitHub Actions.",
    "stars": 1213,
    "license": "MIT",
    "last_pushed_at": "2025-11-11T17:17:13Z",
    "archived": false,
    "official": true,
    "verified_at": "2026-06-08",
    "status": "active"
  },
  {
    "repo": "basecamp/gh-signoff",
    "name": "signoff",
    "category": "Actions/CI",
    "summary": "Run local CI-style checks before signing off work.",
    "install": "gh extension install basecamp/gh-signoff",
    "best_for": "Developers who want a repeatable pre-merge local signoff flow.",
    "avoid_if": "Your project has no local check commands.",
    "stars": 1076,
    "license": "MIT",
    "last_pushed_at": "2025-11-05T22:59:53Z",
    "archived": false,
    "official": false,
    "verified_at": "2026-06-08",
    "status": "active"
  },
  {
    "repo": "dlvhdr/gh-enhance",
    "name": "enhance",
    "category": "Actions/CI",
    "summary": "A fast terminal UI for inspecting and managing GitHub Actions.",
    "install": "gh extension install dlvhdr/gh-enhance",
    "best_for": "Developers who want an interactive terminal UI for GitHub Actions workflows.",
    "avoid_if": "You only need basic workflow status output or prefer the GitHub web UI.",
    "stars": 193,
    "license": "MIT",
    "last_pushed_at": "2026-06-07T09:10:56Z",
    "archived": false,
    "official": false,
    "verified_at": "2026-06-08",
    "status": "active"
  },
  {
    "repo": "fchimpan/gh-workflow-stats",
    "name": "workflow-stats",
    "category": "Actions/CI",
    "summary": "Calculate workflow and job success rate and execution time.",
    "install": "gh extension install fchimpan/gh-workflow-stats",
    "best_for": "CI owners investigating slow or flaky workflows.",
    "avoid_if": "You only need the latest run status.",
    "stars": 109,
    "license": "MIT",
    "last_pushed_at": "2026-03-23T06:34:25Z",
    "archived": false,
    "official": false,
    "verified_at": "2026-06-08",
    "status": "active"
  },
  {
    "repo": "fchimpan/gh-slimify",
    "name": "slimify",
    "category": "Actions/CI",
    "summary": "Detect workflows that can move to cost-efficient slim runners.",
    "install": "gh extension install fchimpan/gh-slimify",
    "best_for": "Teams trying to reduce GitHub Actions runner cost.",
    "avoid_if": "You do not use GitHub-hosted runners.",
    "stars": 105,
    "license": "NOASSERTION",
    "last_pushed_at": "2026-03-06T06:14:39Z",
    "archived": false,
    "official": false,
    "verified_at": "2026-06-08",
    "status": "active"
  },
  {
    "repo": "nektos/gh-act",
    "name": "act",
    "category": "Actions/CI",
    "summary": "Run GitHub Actions locally through a GitHub CLI extension.",
    "install": "gh extension install nektos/gh-act",
    "best_for": "Developers testing workflows before pushing.",
    "avoid_if": "Your workflows depend heavily on GitHub-hosted runner-only services.",
    "stars": 103,
    "license": "MIT",
    "last_pushed_at": "2026-06-01T03:23:24Z",
    "archived": false,
    "official": false,
    "verified_at": "2026-06-08",
    "status": "active"
  },
  {
    "repo": "rsese/gh-actions-status",
    "name": "actions-status",
    "category": "Actions/CI",
    "summary": "View the overall health of an organization's use of Actions.",
    "install": "gh extension install rsese/gh-actions-status",
    "best_for": "Organization-level GitHub Actions reporting.",
    "avoid_if": "You only need a single repository workflow status.",
    "stars": 52,
    "license": "NOASSERTION",
    "last_pushed_at": "2023-05-15T04:12:00Z",
    "archived": false,
    "official": false,
    "verified_at": "2026-06-08",
    "status": "stale"
  }
]
