[
  {
    "repo": "github/gh-aw",
    "name": "aw",
    "category": "AI/Agents",
    "summary": "Run GitHub agentic workflows from the CLI.",
    "install": "gh extension install github/gh-aw",
    "best_for": "Developers experimenting with GitHub-native agent workflows.",
    "avoid_if": "You are not using agentic automation yet.",
    "stars": 4587,
    "license": "MIT",
    "last_pushed_at": "2026-06-08T11:02:52Z",
    "archived": false,
    "official": true,
    "verified_at": "2026-06-08",
    "status": "active"
  },
  {
    "repo": "github/gh-models",
    "name": "models",
    "category": "AI/Agents",
    "summary": "Use GitHub Models from GitHub CLI.",
    "install": "gh extension install github/gh-models",
    "best_for": "Developers testing prompts and models from the terminal.",
    "avoid_if": "You do not use GitHub Models.",
    "stars": 200,
    "license": "MIT",
    "last_pushed_at": "2026-06-04T21:52:35Z",
    "archived": false,
    "official": true,
    "verified_at": "2026-06-08",
    "status": "active"
  },
  {
    "repo": "sgoedecke/gh-standup",
    "name": "standup",
    "category": "AI/Agents",
    "summary": "Generate an AI-assisted standup report from GitHub activity.",
    "install": "gh extension install sgoedecke/gh-standup",
    "best_for": "Developers who prepare regular written standup updates.",
    "avoid_if": "You cannot send repository activity to an AI provider.",
    "stars": 108,
    "license": "MIT",
    "last_pushed_at": "2026-04-23T03:04:27Z",
    "archived": false,
    "official": false,
    "verified_at": "2026-06-08",
    "status": "active"
  },
  {
    "repo": "shuymn/gh-mcp",
    "name": "mcp",
    "category": "AI/Agents",
    "summary": "Run GitHub MCP Server using existing GitHub CLI authentication.",
    "install": "gh extension install shuymn/gh-mcp",
    "best_for": "Users connecting AI tools to GitHub through MCP.",
    "avoid_if": "You do not use MCP-compatible clients.",
    "stars": 31,
    "license": "MIT",
    "last_pushed_at": "2026-06-05T17:03:51Z",
    "archived": false,
    "official": false,
    "verified_at": "2026-06-08",
    "status": "active"
  }
]
