[
  {
    "repo": "dlvhdr/gh-dash",
    "name": "dash",
    "category": "Dashboard/TUI",
    "summary": "A rich terminal dashboard for pull requests, issues, and notifications.",
    "install": "gh extension install dlvhdr/gh-dash",
    "best_for": "Maintainers who live in PR, issue, and notification queues.",
    "avoid_if": "You prefer one-off commands over a persistent TUI.",
    "stars": 11847,
    "license": "MIT",
    "last_pushed_at": "2026-06-07T09:06:35Z",
    "archived": false,
    "official": false,
    "verified_at": "2026-06-08",
    "status": "active"
  },
  {
    "repo": "github/gh-aw",
    "name": "aw",
    "category": "AI/Agents",
    "summary": "Run GitHub agentic workflows from the CLI.",
    "install": "gh extension install github/gh-aw",
    "best_for": "Developers experimenting with GitHub-native agent workflows.",
    "avoid_if": "You are not using agentic automation yet.",
    "stars": 4587,
    "license": "MIT",
    "last_pushed_at": "2026-06-08T11:02:52Z",
    "archived": false,
    "official": true,
    "verified_at": "2026-06-08",
    "status": "active"
  },
  {
    "repo": "github/gh-stack",
    "name": "stack",
    "category": "PR & Issues",
    "summary": "Manage stacked pull requests on GitHub.",
    "install": "gh extension install github/gh-stack",
    "best_for": "Teams that split large changes into dependent PRs.",
    "avoid_if": "Your team avoids stacked changes.",
    "stars": 457,
    "license": "MIT",
    "last_pushed_at": "2026-06-04T16:38:41Z",
    "archived": false,
    "official": true,
    "verified_at": "2026-06-08",
    "status": "active"
  },
  {
    "repo": "seachicken/gh-poi",
    "name": "poi",
    "category": "Repo & Branch",
    "summary": "Safely clean up local branches.",
    "install": "gh extension install seachicken/gh-poi",
    "best_for": "Developers who want a trustworthy branch cleanup default.",
    "avoid_if": "You want to manually inspect every branch before deletion.",
    "stars": 966,
    "license": "MIT",
    "last_pushed_at": "2026-06-05T06:23:08Z",
    "archived": false,
    "official": false,
    "verified_at": "2026-06-08",
    "status": "active"
  },
  {
    "repo": "yusukebe/gh-markdown-preview",
    "name": "markdown-preview",
    "category": "Dashboard/TUI",
    "summary": "Preview Markdown as it appears on GitHub.",
    "install": "gh extension install yusukebe/gh-markdown-preview",
    "best_for": "README, issue template, and documentation review.",
    "avoid_if": "You need fully offline preview support.",
    "stars": 846,
    "license": "MIT",
    "last_pushed_at": "2026-05-21T07:33:02Z",
    "archived": false,
    "official": false,
    "verified_at": "2026-06-08",
    "status": "active"
  },
  {
    "repo": "advanced-security/gh-sbom",
    "name": "sbom",
    "category": "Security/Admin",
    "summary": "Generate software bills of materials with GitHub CLI.",
    "install": "gh extension install advanced-security/gh-sbom",
    "best_for": "Teams that need SBOM output during release or compliance work.",
    "avoid_if": "Your SBOM workflow is already handled by another build step.",
    "stars": 206,
    "license": "MIT",
    "last_pushed_at": "2025-05-30T19:40:06Z",
    "archived": false,
    "official": true,
    "verified_at": "2026-06-08",
    "status": "watch"
  },
  {
    "repo": "gennaro-tedesco/gh-s",
    "name": "s",
    "category": "Search",
    "summary": "Interactively search GitHub repositories.",
    "install": "gh extension install gennaro-tedesco/gh-s",
    "best_for": "Finding repositories quickly from a terminal workflow.",
    "avoid_if": "You need advanced code search rather than repository search.",
    "stars": 404,
    "license": "Apache-2.0",
    "last_pushed_at": "2025-08-20T11:48:41Z",
    "archived": false,
    "official": false,
    "verified_at": "2026-06-08",
    "status": "active"
  },
  {
    "repo": "meiji163/gh-notify",
    "name": "notify",
    "category": "Notifications",
    "summary": "Display GitHub notifications in the terminal.",
    "install": "gh extension install meiji163/gh-notify",
    "best_for": "Developers who want notification awareness without the browser.",
    "avoid_if": "You already manage notifications through email or mobile.",
    "stars": 344,
    "license": "Unlicense",
    "last_pushed_at": "2026-06-05T14:21:26Z",
    "archived": false,
    "official": false,
    "verified_at": "2026-06-08",
    "status": "active"
  },
  {
    "repo": "agynio/gh-pr-review",
    "name": "pr-review",
    "category": "PR & Issues",
    "summary": "View, navigate, reply to, and resolve PR review threads.",
    "install": "gh extension install agynio/gh-pr-review",
    "best_for": "Reviewers who want inline PR review workflows in the terminal.",
    "avoid_if": "Your team reviews exclusively in the GitHub web UI.",
    "stars": 159,
    "license": "MIT",
    "last_pushed_at": "2026-04-13T13:28:48Z",
    "archived": false,
    "official": false,
    "verified_at": "2026-06-08",
    "status": "active"
  },
  {
    "repo": "fchimpan/gh-workflow-stats",
    "name": "workflow-stats",
    "category": "Actions/CI",
    "summary": "Calculate workflow and job success rate and execution time.",
    "install": "gh extension install fchimpan/gh-workflow-stats",
    "best_for": "CI owners investigating slow or flaky workflows.",
    "avoid_if": "You only need the latest run status.",
    "stars": 109,
    "license": "MIT",
    "last_pushed_at": "2026-03-23T06:34:25Z",
    "archived": false,
    "official": false,
    "verified_at": "2026-06-08",
    "status": "active"
  }
]
