[
  {
    "repo": "github/gh-stack",
    "name": "stack",
    "category": "PR & Issues",
    "summary": "Manage stacked pull requests on GitHub.",
    "install": "gh extension install github/gh-stack",
    "best_for": "Teams that split large changes into dependent PRs.",
    "avoid_if": "Your team avoids stacked changes.",
    "stars": 457,
    "license": "MIT",
    "last_pushed_at": "2026-06-04T16:38:41Z",
    "archived": false,
    "official": true,
    "verified_at": "2026-06-08",
    "status": "active"
  },
  {
    "repo": "agynio/gh-pr-review",
    "name": "pr-review",
    "category": "PR & Issues",
    "summary": "View, navigate, reply to, and resolve PR review threads.",
    "install": "gh extension install agynio/gh-pr-review",
    "best_for": "Reviewers who want inline PR review workflows in the terminal.",
    "avoid_if": "Your team reviews exclusively in the GitHub web UI.",
    "stars": 159,
    "license": "MIT",
    "last_pushed_at": "2026-04-13T13:28:48Z",
    "archived": false,
    "official": false,
    "verified_at": "2026-06-08",
    "status": "active"
  },
  {
    "repo": "valeriobelli/gh-milestone",
    "name": "milestone",
    "category": "PR & Issues",
    "summary": "Manage GitHub milestones from the terminal.",
    "install": "gh extension install valeriobelli/gh-milestone",
    "best_for": "Maintainers who use milestones for release planning.",
    "avoid_if": "Your project does not use GitHub milestones.",
    "stars": 79,
    "license": "MIT",
    "last_pushed_at": "2026-02-15T11:10:07Z",
    "archived": false,
    "official": false,
    "verified_at": "2026-06-08",
    "status": "active"
  },
  {
    "repo": "InditexTech/gh-sherpa",
    "name": "sherpa",
    "category": "PR & Issues",
    "summary": "Create branches and pull requests from Jira or GitHub issues.",
    "install": "gh extension install InditexTech/gh-sherpa",
    "best_for": "Teams that connect issue tracking to branch and PR creation.",
    "avoid_if": "You do not use structured issue-based workflows.",
    "stars": 76,
    "license": "Apache-2.0",
    "last_pushed_at": "2026-05-28T08:25:01Z",
    "archived": false,
    "official": false,
    "verified_at": "2026-06-08",
    "status": "active"
  },
  {
    "repo": "hectcastro/gh-metrics",
    "name": "metrics",
    "category": "PR & Issues",
    "summary": "Summarize pull request metrics.",
    "install": "gh extension install hectcastro/gh-metrics",
    "best_for": "Maintainers who track review and merge health.",
    "avoid_if": "You only need individual PR details.",
    "stars": 62,
    "license": "Apache-2.0",
    "last_pushed_at": "2026-06-04T23:02:26Z",
    "archived": false,
    "official": false,
    "verified_at": "2026-06-08",
    "status": "active"
  },
  {
    "repo": "kawarimidoll/gh-prism",
    "name": "prism",
    "category": "PR & Issues",
    "summary": "Review pull requests from GitHub CLI.",
    "install": "gh extension install kawarimidoll/gh-prism",
    "best_for": "Developers who want a focused PR review helper.",
    "avoid_if": "You need full project management features.",
    "stars": 44,
    "license": "MIT",
    "last_pushed_at": "2026-04-07T02:43:35Z",
    "archived": false,
    "official": false,
    "verified_at": "2026-06-08",
    "status": "active"
  },
  {
    "repo": "einride/gh-dependabot",
    "name": "dependabot",
    "category": "PR & Issues",
    "summary": "Review Dependabot pull requests from GitHub CLI.",
    "install": "gh extension install einride/gh-dependabot",
    "best_for": "Teams that process many dependency update pull requests.",
    "avoid_if": "You do not use Dependabot.",
    "stars": 43,
    "license": "MIT",
    "last_pushed_at": "2026-04-16T09:16:50Z",
    "archived": false,
    "official": false,
    "verified_at": "2026-06-08",
    "status": "active"
  },
  {
    "repo": "jackchuka/gh-dep",
    "name": "dep",
    "category": "PR & Issues",
    "summary": "Bulk manage dependency pull requests in a TUI.",
    "install": "gh extension install jackchuka/gh-dep",
    "best_for": "Teams with many Dependabot or Renovate pull requests.",
    "avoid_if": "You rarely receive dependency update PRs.",
    "stars": 29,
    "license": "MIT",
    "last_pushed_at": "2026-06-08T09:07:32Z",
    "archived": false,
    "official": false,
    "verified_at": "2026-06-08",
    "status": "active"
  },
  {
    "repo": "Zer0codestuff/gh-issue-scout",
    "name": "issue-scout",
    "category": "PR & Issues",
    "summary": "Find recent, active, and apparently unclaimed GitHub issues with transparent scoring.",
    "install": "gh extension install Zer0codestuff/gh-issue-scout",
    "best_for": "Contributors choosing an active issue before they invest time in a fix.",
    "avoid_if": "You need a maintainer dashboard or automated issue claiming.",
    "stars": 0,
    "license": "MIT",
    "last_pushed_at": "2026-08-29T21:39:07Z",
    "archived": false,
    "official": false,
    "verified_at": "2026-08-29",
    "status": "active"
  },
  {
    "repo": "gennaro-tedesco/gh-i",
    "name": "i",
    "category": "PR & Issues",
    "summary": "Interactively search GitHub issues.",
    "install": "gh extension install gennaro-tedesco/gh-i",
    "best_for": "Maintainers searching issues without opening the browser.",
    "avoid_if": "You need project-management features beyond search.",
    "stars": 72,
    "license": "Apache-2.0",
    "last_pushed_at": "2025-03-01T01:29:30Z",
    "archived": false,
    "official": false,
    "verified_at": "2026-06-08",
    "status": "watch"
  },
  {
    "repo": "KOBA789/gh-sql",
    "name": "sql",
    "category": "PR & Issues",
    "summary": "Query GitHub Projects data with SQL.",
    "install": "gh extension install KOBA789/gh-sql",
    "best_for": "Advanced users exploring GitHub Projects data.",
    "avoid_if": "You want a beginner-friendly project dashboard.",
    "stars": 134,
    "license": "NOASSERTION",
    "last_pushed_at": "2023-06-19T05:59:30Z",
    "archived": false,
    "official": false,
    "verified_at": "2026-06-08",
    "status": "stale"
  },
  {
    "repo": "samcoe/gh-triage",
    "name": "triage",
    "category": "PR & Issues",
    "summary": "Triage GitHub issues from the terminal.",
    "install": "gh extension install samcoe/gh-triage",
    "best_for": "Maintainers processing issue queues.",
    "avoid_if": "You need an actively maintained triage tool.",
    "stars": 34,
    "license": "MIT",
    "last_pushed_at": "2022-03-28T07:41:27Z",
    "archived": false,
    "official": false,
    "verified_at": "2026-06-08",
    "status": "stale"
  }
]
