[
  {
    "repo": "dlvhdr/gh-dash",
    "name": "dash",
    "category": "Dashboard/TUI",
    "summary": "A rich terminal dashboard for pull requests, issues, and notifications.",
    "install": "gh extension install dlvhdr/gh-dash",
    "best_for": "Maintainers who live in PR, issue, and notification queues.",
    "avoid_if": "You prefer one-off commands over a persistent TUI.",
    "stars": 11847,
    "license": "MIT",
    "last_pushed_at": "2026-06-07T09:06:35Z",
    "archived": false,
    "official": false,
    "verified_at": "2026-06-08",
    "status": "active"
  },
  {
    "repo": "github/gh-skyline",
    "name": "skyline",
    "category": "Dashboard/TUI",
    "summary": "Generate a 3D model of GitHub contribution history.",
    "install": "gh extension install github/gh-skyline",
    "best_for": "Profile visualizations, demos, and community events.",
    "avoid_if": "You need an operational productivity tool.",
    "stars": 1284,
    "license": "MIT",
    "last_pushed_at": "2026-05-28T20:19:35Z",
    "archived": false,
    "official": true,
    "verified_at": "2026-06-08",
    "status": "active"
  },
  {
    "repo": "yusukebe/gh-markdown-preview",
    "name": "markdown-preview",
    "category": "Dashboard/TUI",
    "summary": "Preview Markdown as it appears on GitHub.",
    "install": "gh extension install yusukebe/gh-markdown-preview",
    "best_for": "README, issue template, and documentation review.",
    "avoid_if": "You need fully offline preview support.",
    "stars": 846,
    "license": "MIT",
    "last_pushed_at": "2026-05-21T07:33:02Z",
    "archived": false,
    "official": false,
    "verified_at": "2026-06-08",
    "status": "active"
  },
  {
    "repo": "kawarimidoll/gh-graph",
    "name": "graph",
    "category": "Dashboard/TUI",
    "summary": "Display a GitHub contribution graph in the terminal.",
    "install": "gh extension install kawarimidoll/gh-graph",
    "best_for": "Users who want contribution history without opening a profile page.",
    "avoid_if": "You need repository management features.",
    "stars": 138,
    "license": "MIT",
    "last_pushed_at": "2026-01-04T11:26:37Z",
    "archived": false,
    "official": false,
    "verified_at": "2026-06-08",
    "status": "active"
  },
  {
    "repo": "thiagokokada/gh-gfm-preview",
    "name": "gfm-preview",
    "category": "Dashboard/TUI",
    "summary": "Preview GitHub-flavored Markdown, including offline workflows.",
    "install": "gh extension install thiagokokada/gh-gfm-preview",
    "best_for": "Writers who need Markdown preview without relying on GitHub web UI.",
    "avoid_if": "You only need the simplest browser-based preview.",
    "stars": 94,
    "license": "MIT",
    "last_pushed_at": "2026-06-01T17:11:02Z",
    "archived": false,
    "official": false,
    "verified_at": "2026-06-08",
    "status": "active"
  },
  {
    "repo": "mislav/gh-contrib",
    "name": "contrib",
    "category": "Dashboard/TUI",
    "summary": "Render your GitHub contribution graph in the terminal.",
    "install": "gh extension install mislav/gh-contrib",
    "best_for": "Users who want a lightweight profile visualization command.",
    "avoid_if": "You need repository or PR management features.",
    "stars": 54,
    "license": "Unlicense",
    "last_pushed_at": "2026-01-03T18:06:52Z",
    "archived": false,
    "official": false,
    "verified_at": "2026-06-08",
    "status": "active"
  },
  {
    "repo": "gizmo385/gh-lazy",
    "name": "lazy",
    "category": "Dashboard/TUI",
    "summary": "A terminal UI for interacting with GitHub.",
    "install": "gh extension install gizmo385/gh-lazy",
    "best_for": "Users who want a compact TUI for GitHub resources.",
    "avoid_if": "You prefer scriptable command output.",
    "stars": 33,
    "license": "MIT",
    "last_pushed_at": "2026-05-03T09:03:29Z",
    "archived": false,
    "official": false,
    "verified_at": "2026-06-08",
    "status": "active"
  },
  {
    "repo": "jrnxf/gh-eco",
    "name": "eco",
    "category": "Dashboard/TUI",
    "summary": "Explore GitHub profiles and ecosystem information.",
    "install": "gh extension install jrnxf/gh-eco",
    "best_for": "Developers exploring GitHub communities and profiles.",
    "avoid_if": "You need a narrowly focused productivity command.",
    "stars": 475,
    "license": "MIT",
    "last_pushed_at": "2024-09-03T14:14:49Z",
    "archived": false,
    "official": false,
    "verified_at": "2026-06-08",
    "status": "watch"
  }
]
